{
  "id": "WF-001",
  "name": "Generate LODs",
  "description": "",
  "status": "active",
  "type": "pipeline",
  "variables": [],
  "createdAt": "2026-10-01T12:00:00Z",
  "updatedAt": "2026-10-01T12:00:00Z",
  "steps": [
    {
      "id": "step-1",
      "name": "On File Change",
      "type": "trigger",
      "tool": "Filesystem"
    },
    {
      "id": "step-2",
      "name": "Generate LODs",
      "type": "agent",
      "tool": "Blender (MCP)",
      "prompt": "Make LODs for {{asset}}."
    }
  ]
}
